{
  "$id": "https://mavlink.io/mavlink-m/definition-manifest.schema.json",
  "$schema": "http://json-schema.org/draft-07/schema#",
  "description": "Schema for an immutable manifest identifying the definition set of one MAVLink-M release. Each release has one canonical manifest, so every build of a release reports the same digest, whatever revision of the included definitions it is generated against.",
  "type": "object",
  "properties": {
    "schemaVersion": {
      "description": "Version of this manifest format.",
      "type": "integer",
      "minimum": 1
    },
    "definitionName": {
      "description": "Stable name of the definition set.",
      "type": "string",
      "minLength": 1
    },
    "definitionRelease": {
      "description": "Human-readable release label. Compatibility is determined from the file digests, not this label.",
      "type": "string",
      "minLength": 1
    },
    "files": {
      "description": "Every definition file needed to reproduce the supported semantics, including included MAVLink XML at the revision the release pins, related MAVLink XML, metadata schemas, and external dictionaries.",
      "type": "array",
      "minItems": 1,
      "uniqueItems": true,
      "items": {
        "$ref": "#/definitions/file"
      },
      "allOf": [
        {
          "contains": {
            "properties": {
              "role": {
                "const": "dialect"
              }
            },
            "required": [
              "role"
            ]
          }
        },
        {
          "contains": {
            "properties": {
              "role": {
                "const": "included-dialect"
              }
            },
            "required": [
              "role"
            ]
          }
        },
        {
          "contains": {
            "properties": {
              "role": {
                "const": "metadata-schema"
              }
            },
            "required": [
              "role"
            ]
          }
        }
      ]
    }
  },
  "required": [
    "schemaVersion",
    "definitionName",
    "definitionRelease",
    "files"
  ],
  "additionalProperties": false,
  "definitions": {
    "file": {
      "type": "object",
      "properties": {
        "role": {
          "description": "How this file contributes to the definition set. related-dialect is MAVLink XML that the dialect does not include but that an implementation builds alongside it for a feature that uses it, such as development.xml for operator control.",
          "type": "string",
          "enum": [
            "dialect",
            "included-dialect",
            "related-dialect",
            "metadata-schema",
            "metadata-dictionary"
          ]
        },
        "uri": {
          "description": "Immutable URI for the exact file.",
          "type": "string",
          "minLength": 1
        },
        "sha256": {
          "description": "Lowercase SHA-256 digest of the exact uncompressed file.",
          "type": "string",
          "pattern": "^[0-9a-f]{64}$"
        }
      },
      "required": [
        "role",
        "uri",
        "sha256"
      ],
      "additionalProperties": false
    }
  }
}
